city,url,text,image
abu-dhabi,https://www.lonelyplanet.com/united-arab-emirates/abu-dhabi," Proudly modern and cosmopolitan, Abu Dhabi is the UAE's forward-thinking cultural heart where nothing stands still – except perhaps the herons in its mangroves. The Louvre Abu Dhabi, with its globe-trotting collection covering the breadth of humanity's artistic achievements, finally threw open its doors in 2017. It's the first of the city's planned mega-museum projects to open and a major feather in Abu Dhabi's cap as it pushes to become the region's cultural leader. This world-class museum may get all the buzz but more locally focused sights get a look-in too. Emirati heritage can be difficult to seek out but pearl journey dhow trips and the Abu Dhabi Falcon Hospital take you behind the curtain to get a glimpse of it. Opulent, dramatic and no expense spared: the Sheikh Zayed Grand Mosque is a triumph of Islamic architecture for the modern world. Architectural nods to all the great Islamic empires of past from Fatimid Egypt to South Asia's Mughal dynasty are represented among its blinding white marble facade, but this is a mosque thoroughly of and for the 21st century, with striking contemporary artistry at its heart. Non-Muslims may only be allowed to enter a single mosque in the city, but the one they can, is magnificent. Need some adrenaline in your life? Yas Island provides enough distractions to keep even the most dedicated thrill-seeker happy. This is the setting for the famed Abu Dhabi Grand Prix, the track hallowed ground for Formula One fans. Year-round there are opportunities to hop in the driving seat yourself and make your own Yas Marina Circuit memories. Off the track, Ferrari World and its speed-freak favourite Formula Rossa roller coaster plus Warner Bros World provide full-on family entertainment with enough rides to wear out and sate the thrill tick-list of kids and adults alike. There's no need to leave the city for a beach-break, Abu Dhabi offers a swath of sand for everyone. Saadiyat Island has one of the nicest slices of public beach (with a minimal fee) while Al Bateen, the Corniche and the brand-spanking-new beach on Hudayriat Island offer up completely free swags of sandy fun. On the water, Abu Dhabi's Mangrove National Park showcases a completely different face to a city more known for glinting glass-and-steel skyscrapers than nature. Keep your eyes peeled for flamingos, heron and scuttling crabs as you explore the waterways of this vast forest by kayak.",https://lp-cms-production.imgix.net/2019-06/GettyImages-453802149_super.jpg?auto=format&fit=crop&vib=20&sharp=10&ixlib=react-8.6.4&w=1600&q=40&dpr=5 5x
mumbai-bombay,https://www.lonelyplanet.com/india/mumbai-bombay," Mumbai, formerly Bombay, is big. It’s full of dreamers and hard-labourers, starlets and gangsters, stray dogs and exotic birds, artists and servants, fisherfolk and crorepatis (millionaires), and lots and lots of people. It has India’s most prolific film industry, some of Asia’s biggest slums (as well as the world’s most expensive home) and the largest tropical forest in an urban zone. Mumbai is India’s financial powerhouse, fashion epicentre and a pulse point of religious tension.",https://lp-cms-production.imgix.net/2019-06/7485b46b2aa78a9c4e8384f3f40dca15-mumbai-bombay.jpg?auto=format&fit=crop&vib=20&sharp=10&ixlib=react-8.6.4&w=1600&q=40&dpr=5 5x
auckland-1341384,https://www.lonelyplanet.com/new-zealand/auckland-1341384," Paris may be the city of love, but Auckland is the city of many lovers, according to its Māori name, Tāmaki Makaurau. Those lovers so desired this place that they fought over it for centuries.",https://lp-cms-production.imgix.net/2019-06/117abab027a3741fddf1408491c9ad1a-auckland.jpg?auto=format&fit=crop&vib=20&sharp=10&ixlib=react-8.6.4&w=1600&q=40&dpr=5 5x
jerusalem,https://www.lonelyplanet.com/israel-and-the-palestinian-territories/jerusalem," Destroyed and rebuilt over thousands of years, Jerusalem's spiritual magnetism endures. With interlacing histories, clashing cultures and constant reinvention, the city is an intense, multisensory experience. Jerusalem's Old City is a spiritual lightning rod, sacred to Jews, Muslims and Christians. Wide-eyed with awe, pilgrims flood into the walled city to worship at locations linked to the very foundation of their faith. Church bells, Islamic calls to prayer and the shofar (Jewish ram's horn) electrify the air with a beguiling, if not harmonious, melody, and fragrances of incense, coffee and candle smoke drift through the thrumming souqs (markets). Muslim, Christian, Jewish and Armenian quarters each add their own spice, but this diversity grew from millennia of bloody sieges and transfers of power, leaving still visible deep wounds. Thousands of years of political, territorial, ethnic and religious conflict have scarred Jerusalem. One result of this historic, and ongoing, turbulence is Jerusalem's demographic smorgasbord of immigrants from around the world. Dozens of nationalities are represented, each adding their own spirituality, culture and cuisine to Jerusalem's rich mix, while secular and religious battle lines continue to be drawn and redrawn. The uncertain status of East Jerusalem creates the most painful divisions. Though clashes (sometimes violent) continue, many Palestinians still hope for a future in which East Jerusalem is the capital of a Palestinian state. Even as Jerusalem hurtles towards the future, the past informs its present. Downtown's modern buildings are encased in rosy Jerusalem stone, the same colour palette as the Old City. Experimental performing arts centres are housed in 19th-century buildings. Ever-growing ultra-Orthodox neighbourhoods can be found moments away from million-dollar condominiums, while old-school fruit and vegetable sellers sit next to craft beer and coffee stalls in Mahane Yehuda Market. Meanwhile in East Jerusalem, the future is debated in bookshops, cafes and confronting art galleries. Layers of history continue to be unearthed in Jerusalem, a city where ancient worlds are tantalisingly close. Guides lead groups beneath the Western Wall, and candlelit church crypts hold treasured shrines. At the City of David, visitors are ushered through watery passageways and past active dig sites. Hardly a month goes by without a significant discovery being made in and around the Old City. Unsurprisingly, the city's archaeological sites are highly contentious, in particular the bitterly controversial expansion of the City of David site into Palestinian communities. In Jerusalem, history isn't a closed chapter.",https://lp-cms-production.imgix.net/2019-06/15970771.jpg?auto=format&fit=crop&vib=20&sharp=10&ixlib=react-8.6.4&w=1600&q=40&dpr=5 5x
naples,https://www.lonelyplanet.com/italy/campania/naples," Naples is raw, high-octane energy, a place of soul-stirring art and panoramas, spontaneous conversations and unexpected, inimitable elegance. Welcome to Italy's most unlikely masterpiece. Naples' wealth of cultural assets is extraordinary. You'll find two royal palaces, three castles, and ancient ruins that include some of Christianity's oldest frescoes. The city's Museo Archeologico Nazionale claims the world's finest collection of Pompeiian frescoes and mosaics, while its Cappella Sansevero holds Italy's most extraordinary marble sculpture. You'll find Caravaggio masterpieces in the Pio Monte della Misericordia, Palazzo Zevallos Stigliano and Museo di Capodimonte, the latter palace home to countless masterpieces. Of course, we could also mention all those frescoed baroque cupolas, but that would just be boasting. Naples' millennia-old backstory could bust a bookshelf. Settled by the Greeks and conquered by the Romans, it's a nail-biting tale where myth and fact entwine into one bewitching whole. Did Queen Joan II really throw her lovers to a peckish crocodile in the Castel Nuovo? Do the skulls inside the Cimitero delle Fontanelle have esoteric powers? And just how did alchemist prince Raimondo di Sangro create those inexplicably perfect arterial systems inside his Cappella Sansevero? Curious tales and unsolved mysteries seep out of every Neapolitan stone, casting a strange, hypnotic spell. Blessed with rich volcanic soils, a bountiful sea, and countless generations of culinary know-how, the Naples region is one of Italy's epicurean heavyweights. It's here that you'll find the country's best pizza, pasta and espresso, its most appetising street markets, not to mention some of its most celebrated dishes. From garlicky spaghetti alle vongole (spaghetti with clams) to sultry ragù (meat and tomato sauce) and silky parmigiana di melanzane (eggplant parmigiana), the food on these streets is all about intensity and pleasure. After all, life is too short for diets, so follow the locals' lead and succumb to your gluttonous whims. In Naples, retail therapy is as individualistic as the city itself. Here, global chains still play second fiddle to family-run businesses and artisan workshops. Neapolitan tailors have long lured foreign dandies with their impeccable suits, shirts and ties, while the city's handmade leather gloves are sought by the global fashion royalty. Skinny streets and weathered courtyards are dotted with a plethora of workshops and boutiques, selling everything from butter-soft satchels, organic ceramics and meticulous pastori (nativity-scene figurines), to rare Neapolitan lithographs and gourmet local food and wine. Leave plenty of room in your suitcase.",https://lp-cms-production.imgix.net/2019-06/GettyImages-160593648_high.jpg?auto=format&fit=crop&vib=20&sharp=10&ixlib=react-8.6.4&w=1600&q=40&dpr=5 5x
hobart,https://www.lonelyplanet.com/australia/tasmania/hobart," No doubt about it, Hobart’s future is looking rosy. Tourism is booming and the old town is humming with low vacancy rates, high real-estate prices and new-found self-confidence. Hobart is a harbour town – a port city where the world rushes in on the tide and ebbs away again, bringing with it influences from afar and leaving the locals buzzing with a global zeitgeist. Or so the theory goes. These days Hobart’s waterfront precinct is certainly abuzz, with old pubs alongside new craft-beer bars, myriad cafes, museums, festivals, ferries, fishing boats, yachts, accommodation and a floating pier upholding fine restaurants…all of it washed with sea-salty charm and a sense of history. On a sunny afternoon, there are few more pleasant places to find yourself. Riding high above the city is kunanyi/Mt Wellington, a craggy basalt beast seemingly made for mountain biking and bushwalking. Known as kunanyi by local Aboriginal people, and just 'the mountain' by everybody else, this 1271m-high monolith both defines the city below and shelters it. Drive to the summit in any season – you're assured of either a show-stopping view or an out-of-time, lunar, cloud-shrouded experience, wandering around between snowdrifts, lichen-dappled boulders and the stunted plants that somehow survive in these lofty skies. Finally, barrel back down to the waterfront on a mountain-bike tour like no other. Watery cappuccino? Lukewarm sausage roll? Maybe a deep-fried, reconstituted squid ring? Forget it: the bad old days of Hobart food and drink are long gone. The new order of service here focuses on top-quality local and seasonal produce, turned by deft chefs into marvellous restaurant, cafe and pub meals. Coffee culture is also firmly entrenched, with double-shot pick-me-ups available at every turn. And booze? Cascade Brewery leads Australian's mainstream brewing brigade, but an under-fleet of creative craft-beer breweries is also bubbling up here. And with dinner, cool-climate wines from the nearby Coal and Derwent river valleys are hard to beat. Hobart's summer festival season is an absolute blast! For a few weeks circling around New Year's Eve, this little city goes berserk with travellers, foodies, musicians, and sailors from the Sydney to Hobart Yacht Race turning the town upside down. The Taste of Tasmanian festival, highlighting local produce, is the summer centrepiece. Then, in the depths of winter, Hobart's more macabre, unhinged side comes out to play: the Dark MOFO festival shines a pale gothic light on the city's past and present, with visitors revelling in offbeat performances, feasts, bonfires, installations and plenty of good red wine.",https://lp-cms-production.imgix.net/2019-06/iStock_000056436568XLarge.jpg?auto=format&fit=crop&vib=20&sharp=10&ixlib=react-8.6.4&w=1600&q=40&dpr=5 5x
ho-chi-minh-city,https://www.lonelyplanet.com/vietnam/ho-chi-minh-city," Ho Chi Minh City (HCMC) is Vietnam at its most dizzying: a high-octane city of commerce and culture that has driven the country forward with its pulsating energy. A chaotic whirl, the city breathes life and vitality into all who settle here, and visitors cannot help but be hauled along for the ride.",https://lp-cms-production.imgix.net/2019-06/84631981.jpg?auto=format&fit=crop&vib=20&sharp=10&ixlib=react-8.6.4&w=1600&q=40&dpr=5 5x
valencia,https://www.lonelyplanet.com/spain/valencia-and-murcia/valencia," Spain’s third-largest city is a magnificent place, content for Madrid and Barcelona to grab the headlines while it gets on with being a wonderfully liveable city with thriving cultural, eating and nightlife scenes. Never afraid to innovate, Valencia diverted its flood-prone river to the outskirts and converted the former riverbed into a glorious green ribbon of park winding right through the city. On it are the strikingly futuristic buildings of the Ciudad de las Artes y las Ciencias, designed by local boy Santiago Calatrava. Other brilliant contemporary buildings grace the city, which also has a fistful of fabulous Modernista buildings, great museums, a long stretch of beach and a large, characterful old quarter. Valencia, surrounded by its huerta, a fertile zone of market gardens, is famous as the home of rice dishes such as paella, but its buzzy dining scene offers plenty more besides; it's a superb spot for eating.",https://lp-cms-production.imgix.net/2019-06/55251876.jpg?auto=format&fit=crop&vib=20&sharp=10&ixlib=react-8.6.4&w=1600&q=40&dpr=5 5x
nashville,https://www.lonelyplanet.com/usa/nashville," Nashville is on a roll that just won't stop. Country-music stars are slapping their names on brand-new honky-tonks. Boutique hotels seem to open monthly. Bachelors and bachelorettes are arriving in hordes to party. And acclaimed chefs are going far beyond the meat-and-three, though biscuits and hot chicken are doing just fine. Honky-tonks, boutique hotels and chef-driven restaurants are opening at a head-snapping pace, welcoming bachelors and bachelorette parties galore and a gobsmacking stream of brand-new residents. The Country Music Hall of Fame in downtown Nashville traces the history of country music, whereas museums dedicated to Johnny Cash, George Jones and Willie Nelson delve into their personal stories. Weekly country-music show the Grand Ole Opry, first broadcast on a Nashville radio station, will celebrate its 95th birthday in 2020. The music scene today is as vibrant as ever: seven days a week the neon lights and beer-perfumed air of Lower Broadway draw crowds of grinning music-lovers into its rumbling honky-tonks, while just to the south the vast, undulating roof of Music City Center imprints a giant guitar shape onto the skyline. The Grand Ole Opry wows guests at Opryland and Ryman Auditorium, and hordes of country-music fans descend on the city for the CMA Music Festival. Several country stars have recently opened their own clubs on Broadway. Another reason Nashville's hot: a half-dozen flourishing neighborhoods packed tight with unique shops, indie coffeehouses, innovative bakeries, new breweries and distilleries, and a surprising number of bright murals ready to provide a backdrop for your selfie. East Nashville is home to the city's artisan scene, while 12th Ave S brings the shoppers with its stylish boutiques, vintage collections and gift shops. A sophisticated array of restaurants fills the Gulch, and people-watchers pack out patios in Hillsboro Village. Each neighborhood has a distinct personality, but they're linked by a common commitment to Southern hospitality. If you need a break from bachelorette-party shenanigans or a boring convention panel, step outside for natural distractions aplenty. An ever-growing network of pedestrian and bike-friendly greenways links Nashville's city parks, which unfurl over rolling hills and lush riparian landscapes. B-Cycle bike-rental stations are conveniently placed at greenway trailheads. Nature and outdoor centers inside the larger parks offer kid-friendly activities and nature walks. In total, the city's park system sprawls across more than 12,000 acres in 108 parks, with 19 greenways. Kayaking and canoeing trips on the gentle Harpeth River are well suited to families.",https://lp-cms-production.imgix.net/2019-06/GettyImages-529786649_super.jpg?auto=format&fit=crop&vib=20&sharp=10&ixlib=react-8.6.4&w=1600&q=40&dpr=5 5x
helsinki,https://www.lonelyplanet.com/finland/helsinki," Entwined with the Baltic's bays, inlets and islands, Helsinki's boulevards and backstreets overflow with magnificent architecture, intriguing drinking and dining venues and groundbreaking design. Finland is famed for its streamlined, functional, stylish design. In the 20th century, pioneers such as Alvar and Aino Aalto cemented its reputation, and the capital remains the country's creative hub. Helsinki's design scene is one of the most electrifying in the world today, and a major influence across the globe. Boutiques, workshops and galleries filled with glassware, lighting, textiles and innovative homewares proliferate in the Design District just south of the centre in Punavuori, which is home to Helsinki's superb Design Museum, and throughout the city, from its thoroughfares to repurposed industrial spaces. Taking its cues from the design scene, architecture in Helsinki is flourishing. Contemporary highlights include the Kiasma museum of contemporary art (1998) and concert hall Musiikkitalo (2011). Modernism is exemplified by Alvar Aalto's Akateeminen Kirjakauppa (1969) and Finlandia Talo concert hall (1971), along with Timo and Tuomo Suomalainen's astonishing rock-carved church, the Temppeliaukio (1969). Finland's art-nouveau movement, National Romanticism, has left a glorious legacy of buildings from the era such as Helsinki's beautiful train station (1919). Functionalism, wooden architecture (including 1920s classicism and 2012's Kamppi chapel) and Byzantine-Russian, neo-Renaissance and neoclassical styles are all woven into the city's fabric. Locally sourced, seasonal, sustainably farmed and foraged ingredients might be red-hot worldwide trends today, but in Finland they have long been a way of life. Wildlife such as reindeer, elk, bear and snow grouse, along with shoals of fish such as salmon and freshwater arctic char, find their way onto plates here, together with forest mushrooms, bushels of berries, including lingonberries and prized cloudberries, herbs and specialities such as tar. Finnish flavours can be found all over Helsinki, from a historic kauppahalli (covered market) to venerable restaurants, creative bistros and Michelin-starred gastronomy labs, in addition to international cuisines. While it's a culture-packed urban centre, Helsinki is surrounded by sublime natural environment that's easily reached from every part of the city. Opportunities to get active abound here, from boating to its archipelago's islands, strolling along its beaches and through its extensive parks and gardens, and hiking in its surrounding forests. When snow blankets the city in winter and the seas freeze, snowshoeing, cross-country and downhill skiing, ice skating and ice fishing on the many bays are all invigorating ways to keep warm while staying in touch with nature.",https://lp-cms-production.imgix.net/2019-06/84919753.jpg?auto=format&fit=crop&vib=20&sharp=10&ixlib=react-8.6.4&w=1600&q=40&dpr=5 5x
kolkata-calcutta,https://www.lonelyplanet.com/india/kolkata-calcutta," India’s third-largest city is a daily festival of human existence, simultaneously noble and squalid, cultured and desperate, decidedly futuristic while splendid in decay. By its old spelling, Calcutta readily conjures images of human suffering to most Westerners – although that's not a complete picture of this 330-year-old metropolis. Locally, Kolkata is regarded as India’s intellectual, artistic and cultural capital. Although poverty is certainly apparent, the self-made middle class drives the city's core machinery, a nascent hipster culture thrives among its millennial residents and its dapper Bengali gentry frequent grand colonial-era clubs.",https://lp-cms-production.imgix.net/2019-06/80840681.jpg?auto=format&fit=crop&vib=20&sharp=10&ixlib=react-8.6.4&w=1600&q=40&dpr=5 5x
munich,https://www.lonelyplanet.com/germany/munich," Tall tankards and high-tech cars, edgy art and Lederhosen – Munich is a city where traditional and modern sit side by side like few places on earth. Beer has been part of Munich life for at least seven centuries and the brewing tradition is very much alive and kicking today. Nowhere else in Europe has a beer tradition quite like the Bavarian capital with six mammoth breweries pumping out world-class suds to hundreds of beer gardens and beer halls. And the climax to the Munich beer year is, of course, the famous Oktoberfest, attended by over six million people. Germany’s ‘purity law’ guarantees there’s nothing in your Mass (1L tankard) that shouldn’t be, so if you can lift the thing – ‘Prost!’ (Cheers!) Munich has long been known as the ‘city of art and beer’, so before you head off to the pub, take some time to savour the local art scene. The Kunstareal, Munich’s art quarter, is the place to start, with four major venues displaying everything from Dutch masters to 1960s design. The city also boasts some world-class museums focusing on topics as diverse as Oktoberfest, porcelain and BMW cars. And if that weren't enough, there are still royal palaces to explore – the legacy of 700 years of rule by a single family, the Wittelsbachs. The locals have a word for it – Gemütlichkeit – that untranslatable intermingling of cosiness, well-being and laid-back attitude. In Munich you will sense it most under the fairy lights of a summer beer garden, people-watching in the English Garden and behind the wheel of a BMW heading south. It may be just the local character, but a large share of Gemütlichkeit must come from the fact that the Bavarian capital is one of the most affluent cities on the planet, it’s economy larger than most small countries, its infrastructure well-tended. Munich’s various quirks, the things that make the city the place it is, might be what stick in the memory most. Whether it be the inebriated oompah band, that special knife for eating monster radishes, the Bavarians outrageous dialect, the mad hat traditions of the Oktoberfest or the surfers on the Eisbach wave – you’re sure to discover some freakish aspect of Munich life every day. And then there is the local garb – nowhere else in central Europe do the locals don their traditional costume – the famous Lederhosen and Dirndl – as readily as the Münchners, so why not join them?",https://lp-cms-production.imgix.net/2019-06/59871922.jpg?auto=format&fit=crop&vib=20&sharp=10&ixlib=react-8.6.4&w=1600&q=40&dpr=5 5x
