city,url,text,image
dar-es-salaam,https://www.lonelyplanet.com/tanzania/dar-es-salaam," Over the last century, Dar es Salaam has grown from a sleepy Zaramo fishing village into a thriving tropical metropolis of over four million people. Straddling some of the most important sea routes in the world, it is East Africa’s second-busiest port and Tanzania’s commercial hub. Despite this, and its notorious traffic jams, the city has managed to maintain a low-key, down-to-earth feel.",https://lp-cms-production.imgix.net/2019-06/93209493.jpg?auto=format&fit=crop&vib=20&sharp=10&ixlib=react-8.6.4&w=1600&q=40&dpr=5 5x
lyon,https://www.lonelyplanet.com/france/burgundy-and-the-rhone/lyon," Commanding a strategic spot at the confluence of the Rhône and the Saône Rivers, Lyon has been luring people ever since the Romans named it Lugdunum in 43 BC. Commercial, industrial and banking powerhouse for the past 500 years, Lyon is France's third-largest city, and offers today's urban explorers a wealth of enticing experiences.",https://lp-cms-production.imgix.net/2019-06/110119762_full.jpg?auto=format&fit=crop&vib=20&sharp=10&ixlib=react-8.6.4&w=1600&q=40&dpr=5 5x
amman,https://www.lonelyplanet.com/jordan/amman," As Middle Eastern cities go, Amman is a relative youth, being mostly a creation of the 20th century. But though it lacks the storied history and thrilling architectural tapestry of other regional capitals, there’s plenty here to encourage you to linger awhile before making for Petra, the Dead Sea or Wadi Rum. In fact, Amman is one of the easiest cities in which to enjoy the Middle East experience.",https://lp-cms-production.imgix.net/2019-06/4325bdf24da8cb3d129a26d3a77ecba2-amman.jpg?auto=format&fit=crop&vib=20&sharp=10&ixlib=react-8.6.4&w=1600&q=40&dpr=5 5x
cardiff-caerdydd,https://www.lonelyplanet.com/wales/cardiff-caerdydd," The capital of Wales since just 1955, Cardiff has embraced the role with vigour, emerging in the new millennium as one of Britain’s leading urban centres. Spread between an ancient fort and an ultramodern waterfront, compact Cardiff seems to have surprised even itself with how interesting it has become.",https://lp-cms-production.imgix.net/2019-06/caa4cd3597e2b315c29d1ee4c8aba28f-cardiff-castle.jpg?auto=format&fit=crop&vib=20&sharp=10&ixlib=react-8.6.4&w=1600&q=40&dpr=5 5x
mandalay,https://www.lonelyplanet.com/myanmar-burma/mandalay," Mandalay (မႏၱေလး) will never win any beauty contests. Myanmar's second city is a relatively new creation, founded at the foot of Mandalay Hill in 1857 by King Mindon as his royal capital. The hill, its slopes studded with pagodas, still looms over the city. But Mandalay was bombed flat in WWII and the palace disappeared, along with much else. The palace was rebuilt in the 1990s, and since then Mandalay has undergone a haphazard construction boom that was never about aesthetics. An ever-growing number of motorbikes and cars clog the roads, too, making for a sometimes smoggy city.",https://lp-cms-production.imgix.net/2019-06/GettyImages-184322781_medium.jpg?auto=format&fit=crop&vib=20&sharp=10&ixlib=react-8.6.4&w=1600&q=40&dpr=5 5x
darwin,https://www.lonelyplanet.com/australia/northern-territory/darwin," Australia's only tropical capital city and gateway to the Top End, Darwin, on the traditional lands of the Larrakia, gazes out across the Timor Sea. It's closer to Bali than Bondi and certainly feels removed from the rest of the country, which is just how the locals like it.",https://lp-cms-production.imgix.net/2019-06/GettyImages-148260386_full.jpg?auto=format&fit=crop&vib=20&sharp=10&ixlib=react-8.6.4&w=1600&q=40&dpr=5 5x
beirut,https://www.lonelyplanet.com/lebanon/beirut," If you’re looking for the real East-meets-West so talked about in the Middle East, you need look no further than Beirut. Fast-paced, fashion-conscious and overwhelmingly friendly, it's not a relaxing city to spend time in – it's too crowded, polluted and chaotic for that – but its energy, soul, diversity and intoxicating atmosphere make it a vital, addictive city. A couple of excellent museums are the key sights, but exploring the character of the different districts, strolling the waterfront and diving into the city's wonderful restaurant and nightlife scene are major attractions. As Lebanon is so small, and day trips easy, some travellers base themselves here for their entire visit.",https://lp-cms-production.imgix.net/2019-06/585b69dfa6a5417f6e49fce3e5430ce5-beirut.jpg?auto=format&fit=crop&vib=20&sharp=10&ixlib=react-8.6.4&w=1600&q=40&dpr=5 5x
dallas,https://www.lonelyplanet.com/usa/texas/dallas," Dallas, the 'Big D', is Texas' most mythologized city, rich in the stuff of which American legends are woven. For a time, the eponymous TV series Dallas served to define the USA to the world, while the Cowboys and their cheerleaders remain iconic. Unlike many Texan cities, Dallas has avoided the boom-and-bust cycle of the oil industry, to the point where this is the country’s fastest-growing metropolitan area. There’s money here a-plenty, and conspicuous consumption is very much the norm.",https://lp-cms-production.imgix.net/2019-06/a65c86a8f4a59739fdf2b69d6cb920b3-dallas.jpg?auto=format&fit=crop&vib=20&sharp=10&ixlib=react-8.6.4&w=1600&q=40&dpr=5 5x
kampala,https://www.lonelyplanet.com/uganda/kampala," Bustling Kampala makes a good introduction to Uganda. It’s a dynamic and engaging city, with few of the hassles of other East African capitals and several worthy attractions to keep you occupied for a couple of days. As the heartland of the Buganda kingdom, Kampala has a rich and colourful history, visible in several fascinating palaces and compounds from where the nation was run until the arrival of colonialism.",https://lp-cms-production.imgix.net/2019-06/d1cdc32b270e793246a4ff79cdf6d517-kampala.jpg?auto=format&fit=crop&vib=20&sharp=10&ixlib=react-8.6.4&w=1600&q=40&dpr=5 5x
anchorage,https://www.lonelyplanet.com/usa/alaska/anchorage," Locals like to say that Anchorage is only 30 minutes from Alaska: wedged between 5000ft peaks and an inlet filled with salmon and whales, the Big Apple of the north is unlike any other city.",https://lp-cms-production.imgix.net/2019-06/5530b88bfc44148983855b823777aa77-anchorage.jpg?auto=format&fit=crop&vib=20&sharp=10&ixlib=react-8.6.4&w=1600&q=40&dpr=5 5x
wellington,https://www.lonelyplanet.com/new-zealand/wellington," On a sunny, windless day, Wellington is up there with the best of them. For starters it’s lovely to look at, sitting on a hook-shaped harbour ringed with ranges that wear a cloak of snow in winter. Victorian timber architecture laces the bushy hillsides above the harbour, which resonate with native birdsong.",https://lp-cms-production.imgix.net/2019-06/GettyImages-508491245_super.jpg?auto=format&fit=crop&vib=20&sharp=10&ixlib=react-8.6.4&w=1600&q=40&dpr=5 5x
lefkosia-south-nicosia,https://www.lonelyplanet.com/cyprus/the-republic-of-cyprus/lefkosia-south-nicosia," The capital of the Republic of Cyprus is also its cultural heartbeat. Overlooked by most visitors, reduced to a day-tour jaunt from beach resorts, Nicosia (or Lefkosia, as it's officially known) is a curious and fascinating mix of vibrant street life, confronting division and rich history.",https://lp-cms-production.imgix.net/2019-06/d69f7aae71df88e27926a589c385b1a3-byzantine-art-museum.jpg?auto=format&fit=crop&vib=20&sharp=10&ixlib=react-8.6.4&w=1600&q=40&dpr=5 5x
san-antonio,https://www.lonelyplanet.com/usa/texas/san-antonio," Much the most attractive of Texas’ major cities – and much the oldest too, having celebrated its 300th birthday in 2018 – San Antonio continues to delight visitors. The legendary Alamo, symbol of Texan independence, stands at the very heart of the city, while the River Walk, a glorious network of waterside pathways that’s tucked below street level and lined with bars and restaurants, offers leisurely strolling through downtown and beyond.",https://lp-cms-production.imgix.net/2019-06/a8d99a805cca9ed6991cb0dce5e0e237-riverwalk.jpg?auto=format&fit=crop&vib=20&sharp=10&ixlib=react-8.6.4&w=1600&q=40&dpr=5 5x
nice,https://www.lonelyplanet.com/france/nice," With its mix of real-city grit, old-world opulence, year-round sunshine, vibrant street life and stunning seaside location, no place in France compares with Nice. Before everything else, there was the sea, and the Mediterranean climate – the twin factors that made Nice a tourist magnet as early as the 1700s. Look around and you’ll find the same elemental attractions that drew Europe's belle-époque aristocrats to promenade along the waterfront in horse-drawn carriages. Even now, nothing compares to the simple joy of a balmy beach day interspersed with a spot of people-watching astride the Promenade des Anglais' famous blue chairs. Whether you're skating, kayaking, swimming, sprawled on a beach lounger or transfixed by sunset over the ever-present Med, it's all still happening by the water. For any lover of French and Italian culture, Nice is the perfect hybrid. Long affiliated with Piedmont and Liguria to the east, Savoy to the north and Sardinia to the south, this city only joined France in 1860 and has always kept one foot in Italy. The Italian influence remains palpable everywhere, in Vieux Nice's tall-shuttered, ochre-hued buildings that look airlifted straight in from Portofino, in the fresh pasta shops on every corner and even in the football cheer Issa Nissa! (Go Nice!), shouted in the local Nissart dialect that’s been coloured by Ligurian Italian as much as Occitan French. The Côte d'Azur has ensnared many a visitor with the beauty of its light. Not least Henri Matisse, who came here to convalesce from bronchitis. When the sun finally emerged after a month of wintry drizzle, Matisse was so smitten that he made Nice his home for the next 37 years. Chagall, Picasso and Renoir also fell in love with this place, and Nice was later home to the influential avant-garde École de Nice. Art museums abound throughout the region, but Nice's three superstars – the Musées Matisse, Chagall and d’Art Moderne – are reason enough to justify an aesthetic pilgrimage here. Bring your appetite when you come to Nice. This city is meant for epicures. It all starts at Vieux Nice’s Saleya market, where small producers from the Alpine foothills bring in a bounty of fresh produce, and top chefs from surrounding restaurants shop right beside tourists. The city celebrates its uniqueness with street snacks like socca (chickpea pancakes), pissaladière (caramelised onion tart) or tourte de blettes (chard, raisin and pine nut pie), while its countless cosy bistros serve everything from hearty Provençal beef stew to true salade niçoise to pasta with pistou, and from fresh lemon tart to vegan cheesecake.",https://lp-cms-production.imgix.net/2019-06/3cb45f6e59190e8213ce0a35394d0e11-nice.jpg?auto=format&fit=crop&vib=20&sharp=10&ixlib=react-8.6.4&w=1600&q=40&dpr=5 5x
lahore,https://www.lonelyplanet.com/pakistan/punjab/lahore,,https://lp-cms-production.imgix.net/2019-06/f08e7914532ff0507f29c0f978c415a1-badshahi-mosque.jpg?auto=format&fit=crop&vib=20&sharp=10&ixlib=react-8.6.4&w=1600&q=40&dpr=5 5x
houston,https://www.lonelyplanet.com/usa/texas/houston," Laid-back, pick-up truck and boot-scooting town meets high-powered, high-cultured and high-heeled metropolis, Texas’ largest city – the fourth largest in the entire US – encompasses everything you’d expect to find in the Lone Star State, and plenty more besides. The energy capital of the world, it’s said to enjoy the nation’s highest standard of living, and all that oil wealth has brought plenty of dividends. Its museums – especially the Menil Collection and the associated Rothko Chapel – are extraordinary, while the dining and entertainment scenes are renowned across the region.",https://lp-cms-production.imgix.net/2019-06/b72b5adb6a1d64de663b90e97dabdc11-houston.jpg?auto=format&fit=crop&vib=20&sharp=10&ixlib=react-8.6.4&w=1600&q=40&dpr=5 5x
chennai-madras,https://www.lonelyplanet.com/india/tamil-nadu/chennai-madras," If you have time to explore Chennai (formerly Madras), this 400-sq-km conglomerate of urban villages and diverse neighbourhoods making up Tamil Nadu's capital will pleasantly surprise you. Its role is as keeper of South Indian artistic, religious and culinary traditions.",https://lp-cms-production.imgix.net/2019-06/28902709.jpg?auto=format&fit=crop&vib=20&sharp=10&ixlib=react-8.6.4&w=1600&q=40&dpr=5 5x
antwerp,https://www.lonelyplanet.com/belgium/flanders/antwerp," Antwerp (Antwerpen/Anvers in Dutch/French) is Belgium’s second city, biggest port and capital of cool. It has long been a powerful magnet for everyone from fashion moguls and club queens to art lovers and diamond dealers. In the mid-16th century it was one of Europe’s most important cities and home to baroque superstar painter Pieter Paul Rubens – as many a museum will regularly remind you. Despite many historical travails thereafter, and severe WWII bombing, Antwerp retains an intriguing medieval heart with plenty of café-filled cobbled lanes, a riverside fortress and a truly impressive cathedral. Today, however, Antwerp’s top drawcards are its vibrant fashion and entertainment scene, along with its startling architectural and cultural contrasts.",https://lp-cms-production.imgix.net/2019-06/GettyImages-486812737_super.jpg?auto=format&fit=crop&vib=20&sharp=10&ixlib=react-8.6.4&w=1600&q=40&dpr=5 5x
hilo,https://www.lonelyplanet.com/usa/hawaii/hilo," Kailua-Kona may host more visitors, but Hilo is the beating heart of Hawai‘i Island. Hidden beneath its daily drizzle lies deep soil and soul, from which sprouts a genuine community and aloha spirit. Hilo's demographics still mirror its sugar-town roots, with a diverse mix of Native Hawaiians, Japanese, Filipinos, Portuguese, Puerto Ricans, Chinese and Caucasians.",https://lp-cms-production.imgix.net/2019-06/85ca509c1efd1c1c5d9ea13b2ad0af1f-hilo.jpg?auto=format&fit=crop&vib=20&sharp=10&ixlib=react-8.6.4&w=1600&q=40&dpr=5 5x
marseille,https://www.lonelyplanet.com/france/provence/marseille," Grit and grandeur coexist seamlessly in Marseille, an exuberantly multicultural port city with a pedigree stretching back to classical Greece and a fair claim to the mantle of France's second city. Once seen as somewhat dirty and dangerous, and lacking the glamour of Cannes or St-Tropez, this black sheep of the Provençal coastline has blossomed in cultural confidence since its 2013 stint as the European Capital of Culture. The addition of a brace of swanky new museums is just the outward sign of an optimism and self-belief that's almost palpable.",https://lp-cms-production.imgix.net/2019-06/b089c412c647e05341592171b6d34ba8-marseille.jpg?auto=format&fit=crop&vib=20&sharp=10&ixlib=react-8.6.4&w=1600&q=40&dpr=5 5x
bengaluru-bangalore,https://www.lonelyplanet.com/india/bengaluru-bangalore," Cosmopolitan Bengaluru (formerly Bangalore) is one of India's most progressive and developed cities, blessed with a benevolent climate, a modern metro system, and a burgeoning drinking, dining and shopping scene. Its creature comforts are a godsend to the weary traveller who has done the hard yards, and it's a great city for mixing with locals in craft-beer joints or quirky independent cafes. Though there are no world-class sights, you'll find lovely parks and striking Victorian-era architecture.",https://lp-cms-production.imgix.net/2019-06/9483508eeee2b78a7356a15ed9c337a1-bengaluru-bangalore.jpg?auto=format&fit=crop&vib=20&sharp=10&ixlib=react-8.6.4&w=1600&q=40&dpr=5 5x
london,https://www.lonelyplanet.com/england/london," One of the world's most visited cities, London has something for everyone: from history and culture to fine food and good times. Immersed in history, London's rich seams of eye-opening antiquity are everywhere. The city's buildings are striking milestones in a unique and beguiling biography, and a great many of them – the Tower of London, Westminster Abbey, Big Ben – are instantly recognisable landmarks. There’s more than enough innovation (the Shard, the Tate Modern extension, the Sky Garden) to put a crackle in the air, but it never drowns out London’s seasoned, centuries-old narrative. Architectural grandeur rises up all around you in the West End, ancient remains dot the City and charming pubs punctuate the historic quarters, leafy suburbs and river banks. Take your pick. A tireless innovator of art and culture, London is a city of ideas and the imagination. Londoners have always been fiercely independent thinkers (and critics), but until not so long ago people were suspicious of anything they considered avant-garde. That’s in the past now, and the city’s creative milieu is streaked with left-field attitude, whether it's theatrical innovation, contemporary art, pioneering music, writing, poetry, architecture or design. Food is another creative arena that has become a tireless obsession in certain circles. This city is deeply multicultural, with one in three Londoners foreign-born, representing 270 nationalities and 300 tongues. The UK may have voted for Brexit (although the majority of Londoners didn't), but for now London remains one of the world's most cosmopolitan cities, and diversity infuses daily life, food, music and fashion. It even penetrates intrinsically British institutions; the British Museum and Victoria & Albert Museum have collections as varied as they are magnificent, while the flavours at centuries-old Borough Market run the full global gourmet spectrum. London is as much about wide-open vistas and leafy landscape escapes as it is high-density, sight-packed urban exploration. Central London is where the major museums, galleries and most iconic sights congregate, but visit Hampstead Heath or the Queen Elizabeth Olympic Park to flee the crowds and frolic in wide open green expanses. You can also venture further out to Kew Gardens, Richmond or Hampton Court Palace for beautiful panoramas of riverside London followed by a pint in a quiet waterside pub.",https://lp-cms-production.imgix.net/2019-06/55425108.jpg?auto=format&fit=crop&vib=20&sharp=10&ixlib=react-8.6.4&w=1600&q=40&dpr=5 5x
los-angeles,https://www.lonelyplanet.com/usa/los-angeles," Ruggedly good looking, deeply creative, with a sunny disposition to boot…if LA were on Tinder, the app would crash. Envy is an ugly thing, New York. While your denizens spend their time sniffling and throwing shade in the snow, Angelenos are busy riding waves, tying up their hiking boots and counting their copious blessings. Think about it: in how many megalopolises can you gallop across rugged mountains just nine miles from City Hall? Despite its heaving head count, LA is a city indelibly tied to mighty Mother Nature. Here, dense, vibrant neighborhoods back onto golden beaches, city streets lead up to flower-carpeted hillsides, and huge, deep-blue skies are an IMAX screen for lingering sunsets made to pierce your heart. Dreams are serious business in La La Land. Home to Hollywood, this is a city where fantastical thoughts are encouraged; a place gleefully wrapped in endless layers of modern legend and mythology. Every year countless small-town dreamers pour onto its streets, itching to share their tales with LA and the world – on screen and stage, in lyrics, or on the whitewashed walls of galleries. The end result is an electrifying whirlpool of creativity: edgy art spaces, cult-status rock venues, acclaimed concert halls and thought-provoking stages, all fueling a city addicted to the weird, the wonderful and the downright scandalous. LA's obsession with creative expression extends to its stucco and mortar. After all, this is where movie palaces look like Chinese temples and ancient Egyptian tombs, where concerts halls twist and curve like steely cartoon characters, and where soda bottling plants look like landlocked ocean liners. Indeed, LA celebrates architectural diversity with astounding gusto. From storybook Hollywood abodes and Silver Lake modernist prototypes, to downtown theaters channeling the Palace of Versailles, no other American city delivers such a thrilling mash-up of architectural styles, statements and role models…often on the very same palm-studded street. So which really has the better food scene: LA or SF? While the latter may claim more Michelin stars, LA packs one heck of a culinary punch. It's here that you'll find California's best tacos, the country's most authentic Korean and one of the nation's biggest concentrations of vegan restaurants. And when it comes to imbibing, SF best take a cable car home. From dirty martinis in a basement power station, to craft brews in a steampunk bowling alley, LA has a knack for turning humble drinking sessions into otherworldly adventures worthy of a toast or three.",https://lp-cms-production.imgix.net/2019-06/f4003584e847990e3cae4b5d8062e342-los-angeles.jpg?auto=format&fit=crop&vib=20&sharp=10&ixlib=react-8.6.4&w=1600&q=40&dpr=5 5x
rome,https://www.lonelyplanet.com/italy/rome," A heady mix of haunting ruins, awe-inspiring art and vibrant street life, Italy’s hot-blooded capital is one of the world’s most romantic and charismatic cities. The result of 3000 years of ad hoc urban development, Rome's cityscape is an exhilarating sight. Ancient icons such as the Colosseum, Roman Forum and Pantheon recall the city’s golden age as caput mundi (capital of the world), while monumental basilicas tell of its history as seat of the Catholic Church. Lording it over the skyline, St Peter’s Basilica towers over the Vatican, testifying to the ambition of Rome’s Renaissance popes and the genius of its game-changing architects. Elsewhere, ornate piazzas and showy fountains add a baroque flourish to the city's captivating streets. Few cities can rival Rome's astonishing artistic heritage. Throughout history, the city has starred in the great upheavals of Western art, drawing top artists and inspiring them to push the boundaries of creative achievement. The result is a city awash with priceless treasures. Ancient statues adorn world-class museums; Byzantine mosaics and Renaissance frescoes dazzle in art-rich churches; baroque facades flank medieval piazzas. Stroll through the centre and without even trying you’ll come across masterpieces by the titans of European art – sculptures by Michelangelo, paintings by Caravaggio, frescoes by Raphael and fountains by Bernini. A trip to Rome is as much about lapping up the dolce vita lifestyle as gorging on art and culture. Idling around picturesque streets, whiling away hours at streetside cafes, people-watching on pretty piazzas – these are all central to the Roman experience. The tempo rises in the evening when fashionable drinkers descend on the city’s bars and cafes for a sociable aperitivo (drink with snacks) and trattorias hum with activity. Elsewhere, cheerful hordes mill around popular haunts before heading off to hip cocktail bars and late-night clubs. Eating out is one of Rome's great pleasures and the combination of romantic alfresco settings and superlative food is a guarantee of good times. For contemporary fine dining and five-star wine there are any number of refined restaurants, but for a truly Roman meal head to a boisterous pizzeria or convivial neighbourhood trattoria. That's where the locals go to indulge their passion for thin, crispy pizzas, humble pasta dishes, and cool white wines from the nearby Castelli Romani hills. To finish off, what can beat a gelato followed by a shot of world-beating coffee?",https://lp-cms-production.imgix.net/2019-06/GettyImages-543346435_super.jpg?auto=format&fit=crop&vib=20&sharp=10&ixlib=react-8.6.4&w=1600&q=40&dpr=5 5x
